<?xml version="1.0" encoding="UTF-8"?>
<!DOCTYPE manifesto SYSTEM "file:/Users/cp74/Documents/Universidade/PLC/PRI/Tp2/manifesto.dtd">
<manifesto>
    <meta>
        <id>PRI2018::A73883::TP4</id>
        <titulo>Criação de um Servidor para Website</titulo>
        <subtitulo>Relatório inserido nos trabalhos práticos da cadeira de PRI do MIEI
            2018/19</subtitulo>
        <dinicio>15/10/2018</dinicio>
        <dfim>15/10/2018</dfim>
        <supervisor>
            <nome> José Carlos Ramalho </nome>
            <email>jcr@di.uminho.pt</email>
            <website>http://www4.di.uminho.pt/~jcr/</website>
        </supervisor>
    </meta>
    <equipe>
        <elemento>
            <id>73883</id>
            <nome>Cesário Miguel Pereira Perneta</nome>
            <email>a73883@alunos.uminho.pt</email>
            <foto>eu.jpeg</foto>
        </elemento>
    </equipe>
    <resumo>
        <para>
            Como trabalho de casa, foi pedido que se criasse um <i>Servidor</i> para o <i>Website</i> elaborado na aula. 
            Foi necessário modificar a <i>Stylesheet</i>, para que fossem executadas <b>querys</b> ao servidor e este conseguisse responder.
        </para>
    </resumo>
    <resultados>
        <resultado>
            <titulo>Link para o GitHub com os TPCs de PRI</titulo>
            <path>https://github.com/cesario74/PRI_TPCs_2018</path>
        </resultado>
    </resultados>
</manifesto>
